<?xml version='1.0' encoding='UTF-8' standalone='no' ?>

<!DOCTYPE ordenadores.dtd SYSTEM "dtd/ordenadores.dtd">

<ordenadores>
	<ordenador>
		<sobremesa marca='hp' memoria='4Gb' velocidad='2.2Ghz' n_nucleos='4'>

			<hardware>
				<procesador>Intel Core i5-2537M</procesador>
				<monitor>samsung-22p350</monitor>
				<teclado>inhalambrico</teclado>
				<tarjeta_red>TP-Link TF-3239DL</tarjeta_red>
				<tarjeta_grafica>nvidia_GeForce GTX 590</tarjeta_grafica>
			</hardware>
			<software>
				<bios></bios>
				<sisoperativo>ubuntu 11.04</sisoperativo>
			</software>
		</sobremesa>

		<portatil marca='dell' memoria='8Gb' velocidad='2.6Ghz' n_nucleos='8'>
			<hardware>
				<procesador>intel Core i7-2960XM</procesador>
				<monitor>17 pulgadas</monitor>
				<teclado>normal</teclado>
				<tarjeta_red>LG-Ericsson Smc 1255TX-2</tarjeta_red>
				<tarjeta_grafica>GeForce GTX 560 Ti</tarjeta_grafica>
			</hardware>
			<software>
				<bios></bios>
				<sisoperativo>windows 7</sisoperativo>
			</software>
		</portatil>
	</ordenador>
</ordenadores> 
	
	
	
	